{
  "schemaVersion": 1,
  "productId": "siroino-telescope-cuff-tailor-set",
  "profile": "panel-sewn",
  "shapeKeyPostprocess": {
    "provider": "maxwilso-smooth-shape-keys",
    "applicability": "NOT_REQUIRED",
    "reason": "Initial Telescope Cuff pass uses no garment corrective Shape Keys; structural fit and forearm deformation are owned by canonical fit/weight stages."
  }
}
