{
  "schemaVersion": 1,
  "productId": "siroino-astral-tabi-boot-set",
  "profile": "panel-sewn",
  "target": "SiroinoSotai_PC; coarse Foot/Toe-weighted vertex bounds are measured, but foot surface contours, footwear clearance, shoe size, and last are unverified.",
  "designRevision": "v1-astral-tabi-concept",
  "panels": [
    "left-vamp-medial",
    "left-vamp-lateral",
    "left-instep-tongue",
    "left-medial-quarter",
    "left-lateral-quarter",
    "left-heel-counter",
    "left-collar-liner",
    "right-vamp-medial",
    "right-vamp-lateral",
    "right-instep-tongue",
    "right-medial-quarter",
    "right-lateral-quarter",
    "right-heel-counter",
    "right-collar-liner",
    "left-instep-strap-a",
    "left-instep-strap-b",
    "right-instep-strap-a",
    "right-instep-strap-b"
  ],
  "requiredPatternComponents": [
    {
      "componentId": "left-tabi-upper",
      "partId": "left-boot-upper",
      "requiredPieceIds": [
        "left-vamp-medial",
        "left-vamp-lateral",
        "left-instep-tongue",
        "left-medial-quarter",
        "left-lateral-quarter",
        "left-heel-counter",
        "left-collar-liner"
      ],
      "reason": "Provisional sewn textile upper with visible split-toe construction; seam geometry and opening allowance require 2D review."
    },
    {
      "componentId": "right-tabi-upper",
      "partId": "right-boot-upper",
      "requiredPieceIds": [
        "right-vamp-medial",
        "right-vamp-lateral",
        "right-instep-tongue",
        "right-medial-quarter",
        "right-lateral-quarter",
        "right-heel-counter",
        "right-collar-liner"
      ],
      "reason": "Mirror-side upper hypothesis; left/right dimensions and fit remain unverified."
    }
  ],
  "separateGeometry": [
    "left-outsole",
    "right-outsole",
    "left-midsole",
    "right-midsole",
    "four-strap-buckles",
    "reflective-piping",
    "lunar-phase-emblem"
  ],
  "priorityFitZones": [
    "toe-box",
    "split-toe-web",
    "forefoot-width",
    "instep",
    "arch",
    "heel-cup",
    "ankle-opening",
    "sole-ground-clearance"
  ],
  "researchTrial": {
    "method": "Start with the generated four-view concept reference, decompose each shoe upper into explicit 2D panels, then pair exact boundary edges through pinned GarmentCode/PyGarment.",
    "status": "DECLARED",
    "referenceViews": [
      "front",
      "side",
      "rear",
      "outsole"
    ],
    "physicalSewingStitch": "Per boot, the medial and lateral vamp halves join along a provisional 90 mm web seam and remain open along a 30 mm split-toe edge; each vamp joins a side quarter, quarters close against a heel counter, the collar band attaches in three edge segments and closes its side seam. The instep tongue joins the vamp top edges as a construction hypothesis. Straps and buckles are overlays, not shell seams; sole and midsole are separate geometry.",
    "review": "The target FBX provides only a coarse weighted foot envelope (181 mm longitudinal, 67 mm wide, 72 mm high at default shape-key values); the provisional 2D panel shapes are not flattened from its surface. No foot contour, last, size, circumference, ease, strap length, material thickness, or toe clearance is validated. This stage tests only planar panel topology and GarmentCode edge exchange; do not treat it as a fit or manufacturing pattern."
  },
  "releaseBoundary": "Keep WORKING and visualAppearanceReview PENDING until direct appearance evidence and a reviewed 2D footwear construction pass. Do not initialize 3D before the visualAppearanceReview gate passes; fit and license remain separate pending gates."
}
