{
  "schemaVersion": 1,
  "productId": "siroino-noctelle-shrug-dress-set",
  "profile": "panel-sewn",
  "target": "SiroinoSotai_PC neutral PC body",
  "designRevision": "v1-noctelle-panel-prototype",
  "panels": ["bodice_front_L","bodice_front_R","bodice_back_L","bodice_back_R","skirt_front_L","skirt_front_R","skirt_back_L","skirt_back_R","shrug_back_yoke","shrug_front_L","shrug_front_R","sleeve_upper_L","sleeve_upper_R","sleeve_lower_L","sleeve_lower_R","cuff_L","cuff_R","offshoulder_band"],
  "separateGeometry": ["chest_strap_L","chest_strap_R","back_strap_L","back_strap_R","waist_belt","back_bow_L","back_bow_R","back_bow_knot"],
  "priorityFitZones": ["bust","waist","shoulder","upper-arm","hip","skirt-hem"],
  "requiredPoses": ["neutral","arms-up","arm-cross","crouch","sit","prone"],
  "releaseBoundary": "Technical artifact completion only; no merge, release, BOOTH publication, sales/adoption or third-party approval gate.",
  "clothSimulation": {"applicability":"NOT_REQUIRED","components":[],"evidence":"Weight-driven first manufacturing pass.","reason":"Dress hem, shrug sleeves and bow are required to pass fit/weight evidence without cloth simulation before optional physics is considered."}
}
