{
  "schemaVersion": 1,
  "productId": "siroino-moonlit-tech-parka-outfit",
  "profile": "panel-sewn",
  "shapeKeyPostprocess": {
    "provider": "maxwilso-smooth-shape-keys",
    "applicability": "NOT_REQUIRED",
    "reason": "Initial product uses no garment corrective Shape Keys; structural fit is owned by canonical fit/weight stages."
  }
}
