{
  "schemaVersion": 1,
  "productId": "siroino-military-sheer-romper-large",
  "profile": "panel-sewn",
  "shapeKeyPostprocess": {
    "provider": "maxwilso-smooth-shape-keys",
    "applicability": "NOT_REQUIRED",
    "reason": "Deterministic target-fit generation owns the garment shape keys; the vendor smoothing operator is not required for this path."
  }
}
